{
  "generated_at": "2026-05-15T00:00:00+00:00",
  "scope": "unique_fiche_main_pdfs_only",
  "source_index": "index_fiches_uniques.csv",
  "excluded": [
    "partie_a",
    "annexes",
    "feuilles_recapitulatives",
    "documents_generaux",
    "cee_complements"
  ],
  "summary": {
    "total_unique_fiches": 217,
    "pdf_checked": 217,
    "ok": 217,
    "needs_review": 0,
    "failed": 0,
    "missing_pdf": 0,
    "unreadable_pdf": 0,
    "empty_text": 0,
    "code_not_found_in_text": 0,
    "missing_generated_json": 0,
    "missing_generated_markdown": 0,
    "missing_generated_text": 0,
    "generated_text_mismatch": 0,
    "total_pages": 517,
    "total_text_length": 1007472
  },
  "items": [
    {
      "code": "AGRI-EQ-101",
      "sector": "Agriculture_AGRI",
      "source_file": "Agriculture_AGRI/AGRI-EQ-101 vA14-1.pdf",
      "source_url": "https://www.ecologie.gouv.fr/sites/default/files/documents/AGRI-EQ-101%20vA14-1.pdf",
      "exists": true,
      "page_count": 1,
      "pages_with_text": 1,
      "text_length": 1201,
      "code_found_in_text": true,
      "generated_json_exists": true,
      "generated_markdown_exists": true,
      "generated_text_exists": true,
      "generated_text_matches_pdf": true,
      "status": "ok",
      "warnings": [],
      "error": null
    },
    {
      "code": "AGRI-EQ-102",
      "sector": "Agriculture_AGRI",
      "source_file": "Agriculture_AGRI/AGRI-EQ-102 vA65-2 à compter du 01-04-2025_0.pdf",
      "source_url": "https://www.ecologie.gouv.fr/sites/default/files/documents/AGRI-EQ-102%20vA65-2%20%C3%A0%20compter%20du%2001-04-2025_0.pdf",
      "exists": true,
      "page_count": 1,
      "pages_with_text": 1,
      "text_length": 1266,
      "code_found_in_text": true,
      "generated_json_exists": true,
      "generated_markdown_exists": true,
      "generated_text_exists": true,
      "generated_text_matches_pdf": true,
      "status": "ok",
      "warnings": [],
      "error": null
    },
    {
      "code": "AGRI-EQ-104",
      "sector": "Agriculture_AGRI",
      "source_file": "Agriculture_AGRI/AGRI-EQ-104 vA62-2 à compter du 01-01-2025_0.pdf",
      "source_url": "https://www.ecologie.gouv.fr/sites/default/files/documents/AGRI-EQ-104%20vA62-2%20%C3%A0%20compter%20du%2001-01-2025_0.pdf",
      "exists": true,
      "page_count": 1,
      "pages_with_text": 1,
      "text_length": 1095,
      "code_found_in_text": true,
      "generated_json_exists": true,
      "generated_markdown_exists": true,
      "generated_text_exists": true,
      "generated_text_matches_pdf": true,
      "status": "ok",
      "warnings": [],
      "error": null
    },
    {
      "code": "AGRI-EQ-105",
      "sector": "Agriculture_AGRI",
      "source_file": "Agriculture_AGRI/AGRI-EQ-105 vA28-1 à compter du 19-12-2018.pdf",
      "source_url": "https://www.ecologie.gouv.fr/sites/default/files/documents/AGRI-EQ-105%20vA28-1%20%C3%A0%20compter%20du%2019-12-2018.pdf",
      "exists": true,
      "page_count": 1,
      "pages_with_text": 1,
      "text_length": 1635,
      "code_found_in_text": true,
      "generated_json_exists": true,
      "generated_markdown_exists": true,
      "generated_text_exists": true,
      "generated_text_matches_pdf": true,
      "status": "ok",
      "warnings": [],
      "error": null
    },
    {
      "code": "AGRI-EQ-106",
      "sector": "Agriculture_AGRI",
      "source_file": "Agriculture_AGRI/AGRI-EQ-106 vA32-1.pdf",
      "source_url": "https://www.ecologie.gouv.fr/sites/default/files/documents/AGRI-EQ-106%20vA32-1.pdf",
      "exists": true,
      "page_count": 3,
      "pages_with_text": 3,
      "text_length": 5692,
      "code_found_in_text": true,
      "generated_json_exists": true,
      "generated_markdown_exists": true,
      "generated_text_exists": true,
      "generated_text_matches_pdf": true,
      "status": "ok",
      "warnings": [],
      "error": null
    },
    {
      "code": "AGRI-EQ-107",
      "sector": "Agriculture_AGRI",
      "source_file": "Agriculture_AGRI/AGRI-EQ-107 vA38-1 à compter du 31-07-2021.pdf",
      "source_url": "https://www.ecologie.gouv.fr/sites/default/files/documents/AGRI-EQ-107%20vA38-1%20%C3%A0%20compter%20du%2031-07-2021.pdf",
      "exists": true,
      "page_count": 2,
      "pages_with_text": 2,
      "text_length": 2492,
      "code_found_in_text": true,
      "generated_json_exists": true,
      "generated_markdown_exists": true,
      "generated_text_exists": true,
      "generated_text_matches_pdf": true,
      "status": "ok",
      "warnings": [],
      "error": null
    },
    {
      "code": "AGRI-EQ-108",
      "sector": "Agriculture_AGRI",
      "source_file": "Agriculture_AGRI/AGRI-EQ-108 vA58-2 à compter du 01-02-2024_0.pdf",
      "source_url": "https://www.ecologie.gouv.fr/sites/default/files/documents/AGRI-EQ-108%20vA58-2%20%C3%A0%20compter%20du%2001-02-2024_0.pdf",
      "exists": true,
      "page_count": 2,
      "pages_with_text": 2,
      "text_length": 2936,
      "code_found_in_text": true,
      "generated_json_exists": true,
      "generated_markdown_exists": true,
      "generated_text_exists": true,
      "generated_text_matches_pdf": true,
      "status": "ok",
      "warnings": [],
      "error": null
    },
    {
      "code": "AGRI-EQ-109",
      "sector": "Agriculture_AGRI",
      "source_file": "Agriculture_AGRI/AGRI-EQ-109 vA58-2 à compter du 01-02-2024_0.pdf",
      "source_url": "https://www.ecologie.gouv.fr/sites/default/files/documents/AGRI-EQ-109%20vA58-2%20%C3%A0%20compter%20du%2001-02-2024_0.pdf",
      "exists": true,
      "page_count": 2,
      "pages_with_text": 2,
      "text_length": 3088,
      "code_found_in_text": true,
      "generated_json_exists": true,
      "generated_markdown_exists": true,
      "generated_text_exists": true,
      "generated_text_matches_pdf": true,
      "status": "ok",
      "warnings": [],
      "error": null
    },
    {
      "code": "AGRI-EQ-110",
      "sector": "Agriculture_AGRI",
      "source_file": "Agriculture_AGRI/AGRI-EQ-110 vA38-1 à compter du 31-07-2021.pdf",
      "source_url": "https://www.ecologie.gouv.fr/sites/default/files/documents/AGRI-EQ-110%20vA38-1%20%C3%A0%20compter%20du%2031-07-2021.pdf",
      "exists": true,
      "page_count": 2,
      "pages_with_text": 2,
      "text_length": 3385,
      "code_found_in_text": true,
      "generated_json_exists": true,
      "generated_markdown_exists": true,
      "generated_text_exists": true,
      "generated_text_matches_pdf": true,
      "status": "ok",
      "warnings": [],
      "error": null
    },
    {
      "code": "AGRI-EQ-111",
      "sector": "Agriculture_AGRI",
      "source_file": "Agriculture_AGRI/AGRI-EQ-111 vA62-1 à compter du 31-08-2024_0.pdf",
      "source_url": "https://www.ecologie.gouv.fr/sites/default/files/documents/AGRI-EQ-111%20vA62-1%20%C3%A0%20compter%20du%2031-08-2024_0.pdf",
      "exists": true,
      "page_count": 1,
      "pages_with_text": 1,
      "text_length": 1299,
      "code_found_in_text": true,
      "generated_json_exists": true,
      "generated_markdown_exists": true,
      "generated_text_exists": true,
      "generated_text_matches_pdf": true,
      "status": "ok",
      "warnings": [],
      "error": null
    },
    {
      "code": "AGRI-EQ-112",
      "sector": "Agriculture_AGRI",
      "source_file": "Agriculture_AGRI/AGRI-EQ-112 vA73-3 à compter du 01-09-2025_0.pdf",
      "source_url": "https://www.ecologie.gouv.fr/sites/default/files/documents/AGRI-EQ-112%20vA73-3%20%C3%A0%20compter%20du%2001-09-2025_0.pdf",
      "exists": true,
      "page_count": 1,
      "pages_with_text": 1,
      "text_length": 1771,
      "code_found_in_text": true,
      "generated_json_exists": true,
      "generated_markdown_exists": true,
      "generated_text_exists": true,
      "generated_text_matches_pdf": true,
      "status": "ok",
      "warnings": [],
      "error": null
    },
    {
      "code": "AGRI-SE-101",
      "sector": "Agriculture_AGRI",
      "source_file": "Agriculture_AGRI/AGRI-SE-101 vA40-2 à compter du 01-04-2022_0.pdf",
      "source_url": "https://www.ecologie.gouv.fr/sites/default/files/documents/AGRI-SE-101%20vA40-2%20%C3%A0%20compter%20du%2001-04-2022_0.pdf",
      "exists": true,
      "page_count": 1,
      "pages_with_text": 1,
      "text_length": 1650,
      "code_found_in_text": true,
      "generated_json_exists": true,
      "generated_markdown_exists": true,
      "generated_text_exists": true,
      "generated_text_matches_pdf": true,
      "status": "ok",
      "warnings": [],
      "error": null
    },
    {
      "code": "AGRI-TH-101",
      "sector": "Agriculture_AGRI",
      "source_file": "Agriculture_AGRI/AGRI-TH-101 vA62-2 à compter du 01-01-2025.pdf",
      "source_url": "https://www.ecologie.gouv.fr/sites/default/files/documents/AGRI-TH-101%20vA62-2%20%C3%A0%20compter%20du%2001-01-2025.pdf",
      "exists": true,
      "page_count": 1,
      "pages_with_text": 1,
      "text_length": 1075,
      "code_found_in_text": true,
      "generated_json_exists": true,
      "generated_markdown_exists": true,
      "generated_text_exists": true,
      "generated_text_matches_pdf": true,
      "status": "ok",
      "warnings": [],
      "error": null
    },
    {
      "code": "AGRI-TH-102",
      "sector": "Agriculture_AGRI",
      "source_file": "Agriculture_AGRI/AGRI-TH-102 vA14-1.pdf",
      "source_url": "https://www.ecologie.gouv.fr/sites/default/files/documents/AGRI-TH-102%20vA14-1.pdf",
      "exists": true,
      "page_count": 1,
      "pages_with_text": 1,
      "text_length": 963,
      "code_found_in_text": true,
      "generated_json_exists": true,
      "generated_markdown_exists": true,
      "generated_text_exists": true,
      "generated_text_matches_pdf": true,
      "status": "ok",
      "warnings": [],
      "error": null
    },
    {
      "code": "AGRI-TH-103",
      "sector": "Agriculture_AGRI",
      "source_file": "Agriculture_AGRI/AGRI-TH-103 vA15-1.pdf",